{
  "$schema": "http://json-schema.org/draft-07/schema#",
  "title": "NHMS Run Manifest",
  "description": "HPC job input manifest for NHMS hydrological runs.",
  "type": "object",
  "additionalProperties": false,
  "required": [
    "schema_version",
    "run_id",
    "run_type",
    "scenario_id",
    "start_time",
    "end_time",
    "model",
    "forcing",
    "outputs"
  ],
    "properties": {
      "identity": {
        "description": "M23 production identity/status/URI contract binding this manifest to scheduler, ops, hydro, and published artifacts.",
        "type": "object",
        "additionalProperties": true,
        "required": [
          "run_id",
          "model_id",
          "basin_id",
          "source",
          "cycle_time",
          "basin_version_id",
          "river_network_version_id",
          "canonical_product_id",
          "forcing_version_id",
          "hydro_run_id",
          "published_manifest_id"
        ],
        "properties": {
          "schema_version": { "type": "string" },
          "contract_id": { "type": "string" },
          "run_id": { "type": "string", "minLength": 1 },
          "model_id": { "type": "string", "minLength": 1 },
          "basin_id": { "type": "string", "minLength": 1 },
          "source": { "type": "string", "minLength": 1 },
          "source_id": { "type": "string", "minLength": 1 },
          "cycle_time": { "type": "string", "format": "date-time" },
          "basin_version_id": { "type": "string", "minLength": 1 },
          "river_network_version_id": { "type": "string", "minLength": 1 },
          "canonical_product_id": { "type": "string", "minLength": 1 },
          "forcing_version_id": { "type": "string", "minLength": 1 },
          "hydro_run_id": { "type": "string", "minLength": 1 },
          "published_manifest_id": { "type": "string", "minLength": 1 },
          "pipeline_job_id": { "type": "string", "minLength": 1 },
          "pipeline_event_id": { "type": "string" }
        }
      },
      "schema_version": {
      "description": "Manifest schema version.",
      "type": "string"
    },
    "run_id": {
      "description": "Unique hydrological run identifier.",
      "type": "string",
      "minLength": 1
    },
    "run_type": {
      "description": "Hydrological run type.",
      "type": "string",
      "enum": ["analysis", "forecast", "hindcast"]
    },
    "scenario_id": {
      "description": "Scenario identifier.",
      "type": "string",
      "minLength": 1
    },
    "source_id": {
      "description": "Forecast source identifier.",
      "type": "string",
      "minLength": 1
    },
    "submission_attempt": {
      "description": "Durable accepted-submit attempt of the forecast master that staged this manifest.",
      "type": "integer",
      "minimum": 1
    },
    "candidate_id": {
      "description": "Scheduler candidate identifier (source:cycle_time:model_id:scenario_id).",
      "type": "string",
      "minLength": 1
    },
    "forecast_horizon_hours": {
      "description": "Forecast horizon in hours from start_time to end_time.",
      "type": "number"
    },
    "workspace_dir": {
      "description": "Orchestrator workspace root the runtime resolves relative run paths against.",
      "type": "string",
      "minLength": 1
    },
    "object_store_root": {
      "description": "Local filesystem root of the object store.",
      "type": "string",
      "minLength": 1
    },
    "object_store_prefix": {
      "description": "URI prefix mapped onto object_store_root (for example s3://nhms).",
      "type": "string"
    },
    "display": {
      "description": "Display contract of the run outputs (tiles, output URI, unavailable products).",
      "type": "object",
      "additionalProperties": true
    },
    "quality_states": {
      "description": "Per-surface quality state of the run assembly (display, output river, station forcing).",
      "type": "object",
      "additionalProperties": true
    },
    "residual_blockers": {
      "description": "Known residual blockers of the run assembly, one object per blocker.",
      "type": "array",
      "items": {
        "type": "object",
        "additionalProperties": true
      }
    },
    "cycle_time": {
      "description": "Forecast cycle time in ISO 8601 UTC.",
      "type": "string",
      "format": "date-time"
    },
    "issue_time": {
      "description": "Forecast issue time in ISO 8601 UTC.",
      "type": "string",
      "format": "date-time"
    },
    "start_time": {
      "description": "Run start time in ISO 8601 UTC.",
      "type": "string",
      "format": "date-time"
    },
    "end_time": {
      "description": "Run end time in ISO 8601 UTC.",
      "type": "string",
      "format": "date-time"
    },
    "model": {
      "description": "Model package and version metadata.",
      "type": "object",
      "additionalProperties": true,
      "required": ["model_id", "model_package_uri"],
        "properties": {
        "model_id": {
          "type": "string",
          "minLength": 1
        },
        "basin_version_id": {
          "type": "string"
        },
        "river_network_version_id": {
          "type": "string"
        },
        "model_package_uri": {
          "type": "string",
          "format": "uri"
        },
        "project_name": {
          "type": "string"
        }
      }
    },
    "initial_state": {
      "description": "Initial condition state metadata.",
      "type": "object",
      "additionalProperties": true,
      "properties": {
        "state_id": {
          "description": "Warm-start state snapshot id; null on a cold start or a packaged initial condition.",
          "type": ["string", "null"]
        },
        "ic_file_uri": {
          "description": "Warm-start initial-condition file URI; null on a cold start or a packaged initial condition.",
          "type": ["string", "null"],
          "format": "uri"
        }
      }
    },
    "forcing": {
      "description": "Forcing package metadata.",
      "type": "object",
      "additionalProperties": true,
      "required": ["forcing_uri"],
      "properties": {
        "forcing_version_id": {
          "type": "string"
        },
        "canonical_product_id": {
          "type": "string"
        },
        "forcing_uri": {
          "type": "string",
          "format": "uri"
        }
      }
    },
    "runtime": {
      "description": "Runtime launch settings.",
      "type": "object",
      "additionalProperties": true,
      "properties": {
        "executable": {
          "description": "Optional. The SHUD runtime resolves its executable from SHUD_EXECUTABLE, not from the manifest.",
          "type": "string",
          "minLength": 1
        },
        "threads": {
          "type": "integer",
          "minimum": 1
        },
        "init_mode": {
          "type": "integer"
        },
        "ascii_output": {
          "type": "integer"
        },
        "binary_output": {
          "type": "integer"
        }
      }
    },
    "outputs": {
      "description": "Output object-storage targets.",
      "type": "object",
      "additionalProperties": true,
      "required": ["output_uri"],
      "properties": {
        "output_uri": {
          "type": "string",
          "format": "uri"
        },
        "log_uri": {
          "type": "string",
          "format": "uri"
        },
        "published_manifest_id": {
          "type": "string"
        },
        "run_manifest_uri": {
          "type": "string",
          "format": "uri"
        },
        "required_files": {
          "type": "array",
          "items": {
            "type": "string"
          }
        }
      }
    }
  },
  "if": {
    "properties": {
      "run_type": {
        "const": "forecast"
      }
    },
    "required": ["run_type"]
  },
  "then": {
    "required": ["source_id", "cycle_time", "initial_state"],
    "properties": {
      "initial_state": {
        "type": "object",
        "required": ["ic_file_uri"]
      }
    }
  }
}
